{
  "type": "object",
  "title": "",
  "$schema": "http://json-schema.org/draft-07/schema#",
  "properties": {
    "titleText": {
      "type": "string",
      "title": "Заголовок"
    },
    "titleAlign": {
      "$ref": "#/definitions/SectionTitleAlign",
      "title": "Расположение заголовка"
    },
    "palette": {
      "$ref": "#/definitions/Palette",
      "title": "Палитра цветов"
    },
    "before": {
      "type": "object",
      "title": "До",
      "properties": {
        "image": {
          "$ref": "#/definitions/ImageModel",
          "title": "Изображение"
        }
      },
      "required": [
        "image"
      ]
    },
    "after": {
      "type": "object",
      "title": "После",
      "properties": {
        "image": {
          "$ref": "#/definitions/ImageModel",
          "title": "Изображение"
        }
      },
      "required": [
        "image"
      ]
    },
    "section": {
      "type": "object",
      "title": "Размеры секции",
      "required": [
        "isFullscreen",
        "paddingTop",
        "paddingBottom"
      ],
      "properties": {
        "isFullscreen": {
          "$ref": "#/definitions/OptionalFlag",
          "title": "Растянуть секцию на весь экран"
        },
        "hPaddingDesktop": {
          "$ref": "#/definitions/SectionHPadding",
          "title": "Отступ по краям на десктопе"
        },
        "hPaddingMobile": {
          "$ref": "#/definitions/SectionHPaddingTouch",
          "title": "Отступ по краям на телефоне"
        },
        "paddingTop": {
          "$ref": "#/definitions/SectionVPadding",
          "title": "Отступ над секцией"
        },
        "paddingBottom": {
          "$ref": "#/definitions/SectionVPadding",
          "title": "Отступ под секцией"
        }
      }
    },
    "verticalRhythm": {
      "type": "string",
      "enum": [
        "0",
        "25",
        "50",
        "75",
        "100",
        "150",
        "200",
        "250",
        "300",
        "350",
        "400",
        "450",
        "500",
        "600",
        "700",
        "800",
        "900",
        "1000",
        "1100",
        "1200",
        "1300",
        "1400",
        "1500",
        "1600",
        "1700",
        "1800",
        "1900",
        "2000"
      ],
      "title": "Вертикальный отступ блока (токен темы, с каждой стороны)",
      "default": "500"
    },
    "verticalRhythmTouch": {
      "type": "string",
      "enum": [
        "0",
        "25",
        "50",
        "75",
        "100",
        "150",
        "200",
        "250",
        "300",
        "350",
        "400",
        "450",
        "500",
        "600",
        "700",
        "800",
        "900",
        "1000",
        "1100",
        "1200",
        "1300",
        "1400",
        "1500",
        "1600",
        "1700",
        "1800",
        "1900",
        "2000"
      ],
      "title": "Вертикальный отступ на телефоне (токен темы)",
      "default": "300"
    }
  },
  "required": [
    "before",
    "after",
    "titleText",
    "titleAlign",
    "section"
  ]
}
